{
  "schema_version": "1.0",
  "progetto": {
    "id": "C10",
    "nome": "Trave appoggiata, combinazione SLU di due casi",
    "descrizione": "IPE 300, L = 6 m. Caso G2: q = 10 kN/m; caso Q: P = 20 kN a 2 m dall'appoggio sinistro. Combinazione SLU 1,3·G2 + 1,5·Q (NTC 2018 §2.5.3).",
    "autore": "Valentina (casi di prova)",
    "data": "2026-10-26",
    "tipo_modello": "telaio_piano",
    "unita": {
      "lunghezza": "m",
      "forza": "kN"
    }
  },
  "materiali": [
    {
      "id": "S275",
      "nome": "Acciaio S275",
      "tipo": "acciaio",
      "E": 210000000.0,
      "peso_specifico": 78.5
    }
  ],
  "nodi": [
    {
      "id": 1,
      "x": 0,
      "y": 0
    },
    {
      "id": 2,
      "x": 6,
      "y": 0
    }
  ],
  "sezioni": [
    {
      "id": "IPE300",
      "nome": "IPE 300",
      "A": 0.005381,
      "I": 8.356e-05,
      "W": 0.0005571,
      "fonte": "sagomario profili IPE, asse forte"
    }
  ],
  "aste": [
    {
      "id": 1,
      "nodo_i": 1,
      "nodo_j": 2,
      "materiale": "S275",
      "sezione": "IPE300"
    }
  ],
  "vincoli": [
    {
      "nodo": 1,
      "ux": true,
      "uy": true
    },
    {
      "nodo": 2,
      "uy": true
    }
  ],
  "casi_di_carico": [
    {
      "id": "G2",
      "nome": "Permanenti portati",
      "categoria": "G2",
      "carichi_aste": [
        {
          "asta": 1,
          "tipo": "distribuito_uniforme",
          "direzione": "globale_y",
          "q": -10.0
        }
      ]
    },
    {
      "id": "Q",
      "nome": "Variabile concentrato",
      "categoria": "Q",
      "carichi_aste": [
        {
          "asta": 1,
          "tipo": "concentrato",
          "direzione": "globale_y",
          "P": -20.0,
          "a": 2.0
        }
      ]
    }
  ],
  "analisi": {
    "tipo": "statica_lineare",
    "deformabilita_assiale": true,
    "punti_diagramma": 4
  },
  "combinazioni": [
    {
      "id": "SLU1",
      "nome": "SLU 1,3·G2 + 1,5·Q",
      "tipo": "SLU",
      "coefficienti": {
        "G2": 1.3,
        "Q": 1.5
      }
    }
  ]
}
