{
  "schema_version": "1.0",
  "progetto": {
    "id": "C9",
    "nome": "Portale a tre cerniere con molla al piede",
    "descrizione": "Colonne HE 200 A h = 4 m, traverso IPE 300 L = 6 m con cerniera interna in mezzeria. Piede sinistro a cerniera, piede destro con ux impedito e molla verticale ky = 5000 kN/m. H = 20 kN al nodo 2. Struttura isostatica.",
    "autore": "Valentina (casi di prova)",
    "data": "2026-10-26",
    "tipo_modello": "telaio_piano",
    "unita": {
      "lunghezza": "m",
      "forza": "kN"
    }
  },
  "materiali": [
    {
      "id": "S275",
      "nome": "Acciaio S275",
      "tipo": "acciaio",
      "E": 210000000.0,
      "peso_specifico": 78.5
    }
  ],
  "nodi": [
    {
      "id": 1,
      "x": 0,
      "y": 0
    },
    {
      "id": 2,
      "x": 0,
      "y": 4.0
    },
    {
      "id": 5,
      "nome": "cerniera",
      "x": 3.0,
      "y": 4.0
    },
    {
      "id": 3,
      "x": 6.0,
      "y": 4.0
    },
    {
      "id": 4,
      "x": 6.0,
      "y": 0
    }
  ],
  "sezioni": [
    {
      "id": "HEA200",
      "nome": "HE 200 A",
      "A": 0.005383,
      "I": 3.692e-05,
      "W": 0.0003886,
      "fonte": "sagomario profili HE A, asse forte"
    },
    {
      "id": "IPE300",
      "nome": "IPE 300",
      "A": 0.005381,
      "I": 8.356e-05,
      "W": 0.0005571,
      "fonte": "sagomario profili IPE, asse forte"
    }
  ],
  "aste": [
    {
      "id": 1,
      "nodo_i": 1,
      "nodo_j": 2,
      "materiale": "S275",
      "sezione": "HEA200"
    },
    {
      "id": 2,
      "nodo_i": 2,
      "nodo_j": 5,
      "materiale": "S275",
      "sezione": "IPE300",
      "svincoli": {
        "rz_j": true
      }
    },
    {
      "id": 4,
      "nodo_i": 5,
      "nodo_j": 3,
      "materiale": "S275",
      "sezione": "IPE300"
    },
    {
      "id": 3,
      "nodo_i": 4,
      "nodo_j": 3,
      "materiale": "S275",
      "sezione": "HEA200"
    }
  ],
  "vincoli": [
    {
      "nodo": 1,
      "ux": true,
      "uy": true
    },
    {
      "nodo": 4,
      "ux": true,
      "molle": {
        "ky": 5000.0
      }
    }
  ],
  "casi_di_carico": [
    {
      "id": "H",
      "nome": "Forza orizzontale",
      "categoria": "vento",
      "carichi_nodali": [
        {
          "nodo": 2,
          "Fx": 20.0
        }
      ]
    }
  ],
  "analisi": {
    "tipo": "statica_lineare",
    "deformabilita_assiale": true,
    "punti_diagramma": 5
  }
}
